{
  "$schema": "http://json-schema.org/draft-07/schema#",
  "type": "object",
  "required": ["device", "category", "target", "rig", "alignment", "bands", "signature", "tilt", "features", "precision", "warnings"],
  "additionalProperties": false,
  "properties": {
    "device": {"type": "string"}, "category": {"enum": ["iem", "headphone", "tws"]},
    "target": {"type": "string"}, "rig": {"type": "string"},
    "alignment": {"type": "object", "required": ["method", "offset_db"], "additionalProperties": false,
      "properties": {"method": {"type": "string"}, "offset_db": {"type": "number"}}},
    "bands": {"type": "array", "items": {
      "type": "object", "required": ["id", "hz", "dev_db", "quanta", "label_zh", "label_en"],
      "additionalProperties": false,
      "properties": {"id": {"type": "string"}, "hz": {"type": "array", "items": {"type": "number"}},
        "dev_db": {"type": "number"}, "quanta": {"type": "integer", "minimum": -3, "maximum": 3},
        "label_zh": {"type": "string"}, "label_en": {"type": "string"}}}},
    "signature": {"type": "object", "required": ["label_zh", "label_en", "rule_fired"],
      "additionalProperties": false,
      "properties": {"label_zh": {"type": "string"}, "label_en": {"type": "string"}, "rule_fired": {"type": "string"}}},
    "tilt": {"type": "object", "required": ["tilt_db", "label_zh", "label_en", "low_extension_db", "high_extension_db"],
      "additionalProperties": false,
      "properties": {"tilt_db": {"type": "number"}, "label_zh": {"type": "string"}, "label_en": {"type": "string"},
        "low_extension_db": {"type": "number"}, "high_extension_db": {"type": "number"}}},
    "features": {"type": "array", "items": {
      "type": "object", "required": ["hz", "residual_db", "type", "hint"], "additionalProperties": false,
      "properties": {"hz": {"type": "number"}, "residual_db": {"type": "number"},
        "type": {"enum": ["peak", "dip"]}, "hint": {"type": "string"}}}},
    "precision": {"enum": ["quantitative", "qualitative"]},
    "warnings": {"type": "array", "items": {"type": "string"}}
  }
}
