{
  "device": "fixture:peaky_iem",
  "category": "iem",
  "target": "harman_ie_2019",
  "rig": "iec711",
  "alignment": {
    "method": "anchor_center_mids",
    "offset_db": -64.1
  },
  "bands": [
    {
      "id": "sub_bass",
      "hz": [
        20,
        60
      ],
      "dev_db": -0.3,
      "quanta": 0,
      "label_zh": "中性",
      "label_en": "neutral"
    },
    {
      "id": "mid_bass",
      "hz": [
        60,
        200
      ],
      "dev_db": -0.0,
      "quanta": 0,
      "label_zh": "中性",
      "label_en": "neutral"
    },
    {
      "id": "lower_mids",
      "hz": [
        200,
        500
      ],
      "dev_db": 0.9,
      "quanta": 0,
      "label_zh": "中性",
      "label_en": "neutral"
    },
    {
      "id": "center_mids",
      "hz": [
        500,
        1000
      ],
      "dev_db": 0.0,
      "quanta": 0,
      "label_zh": "中性",
      "label_en": "neutral"
    },
    {
      "id": "upper_mids",
      "hz": [
        1000,
        3000
      ],
      "dev_db": -1.4,
      "quanta": 0,
      "label_zh": "中性",
      "label_en": "neutral"
    },
    {
      "id": "lower_treble",
      "hz": [
        3000,
        6000
      ],
      "dev_db": -2.3,
      "quanta": -1,
      "label_zh": "略少",
      "label_en": "slightly lacking"
    },
    {
      "id": "mid_treble",
      "hz": [
        6000,
        10000
      ],
      "dev_db": 2.6,
      "quanta": 1,
      "label_zh": "略多",
      "label_en": "slightly elevated"
    },
    {
      "id": "air",
      "hz": [
        10000,
        20000
      ],
      "dev_db": -0.6,
      "quanta": 0,
      "label_zh": "中性",
      "label_en": "neutral"
    }
  ],
  "signature": {
    "label_zh": "均衡",
    "label_en": "neutral",
    "rule_fired": "all sections within +/-1"
  },
  "tilt": {
    "tilt_db": 0.1,
    "label_zh": "中性倾斜",
    "label_en": "even",
    "low_extension_db": -0.3,
    "high_extension_db": -0.6
  },
  "features": [
    {
      "hz": 8127.0,
      "residual_db": 3.5,
      "type": "peak",
      "hint": "齿音风险 / sibilance"
    },
    {
      "hz": 4064.0,
      "residual_db": -3.4,
      "type": "dip",
      "hint": "齿音抑制 / de-essed"
    }
  ],
  "precision": "quantitative",
  "warnings": []
}
